{
  "schema_version": "agent-harness.takeover-checkpoint.v1",
  "recorded_at_utc": "2026-09-29T03:01:00Z",
  "repository": {
    "project_id": "bounded-agent-harness",
    "branch": "codex/project-brain-ownership-20260928",
    "head": "d8f13484e578e25a4107b73cf1875b03c1f13523",
    "tracked_source_state": "IN_PROGRESS",
    "expected_git_status": [
      {
        "code": "??",
        "path": "work/",
        "availability": "LOCAL_ONLY"
      }
    ]
  },
  "continuation": {
    "phase": "project-brain ownership and host project-scope integration",
    "status": "READY",
    "objective": "Give Bounded Agent Harness its own portable Project Brain, prevent project checkpoint reuse across projects, and make project-scoped context selection an enforced host boundary.",
    "last_completed": "Published the exact 35-file static BAH candidate from source commit 0150713fcd92629dc0501b9550a8f31b2f414f27 as Netlify deploy 6abb266397e11d601df00913. Netlify reports ready with zero available, required, or edge functions. All 34 publicly served files match the preserved candidate ZIP; `_headers` is control metadata. GitHub exposes the exact source commit. The false access blocker was traced to a local origin pointing at a sibling checkout, sandbox-owned older checkouts, and a missing bundled Git helper path during push; the saved Git credential route remained valid. OPERATOR-GUIDE.md now requires those checks before asking the owner to reconnect anything.",
    "in_progress": null,
    "next_step": "Implement the existing planned host-neutral retrieval/injection adapter so project-scoped context selection is enforced before model context construction. Reuse the current project-scope gate and source materializer; do not add a parallel scope engine or deploy a site for this local step.",
    "resume_command": "From the BAH repository root, read PROJECT-BRAIN/README.md, PROJECT-BRAIN/CURRENT-STATE.md, and PROJECT-BRAIN/NEXT-STEP.md. Preserve the work/ artifacts. Confirm the repository identity is bounded-agent-harness, then implement and test the host-neutral retrieval/injection adapter described in NEXT-STEP.md. For any future Git publication, inspect the remote URL and ownership first; on this bundled Windows runtime set GIT_EXEC_PATH from `git --exec-path` for the push process and dry-run before asking the owner to reconnect GitHub.",
    "do_not_repeat": [
      "Do not put USB, DFW Metro, FreeVibeApps, or game-project current state into the BAH Project Brain.",
      "Do not copy USB product purpose or private owner history; use only the exact USB evidence pointer declared in PROJECT-BRAIN/PROJECT.json when a BAH claim requires it.",
      "Do not publish private HITL Removal or Danger Mode specifications, credentials, or owner records in this public repository.",
      "Do not treat a GitHub connector 403 or empty plugin repository list as proof that the authenticated Git CLI route is unavailable.",
      "Do not ask the owner to reconnect GitHub before checking the actual remote, checkout ownership, `git --exec-path`, and an explicit HTTPS push dry run.",
      "Do not run `pnpm install --offline` in an isolated worktree; the available store lacks the Next.js 16.2.6 tarball. Do not build from a worktree inside website/work or with a node_modules junction in the site tree.",
      "Use `node --test 'test/*.test.mjs'` for the BAH tracked suite while preserved worktrees live under `work/`; bare `node --test` also discovers their tests and can report unrelated junction failures.",
      "The live site is bound to source commit 0150713fcd92629dc0501b9550a8f31b2f414f27 and deploy 6abb266397e11d601df00913; do not replace it without a separate publication GO."
    ]
  },
  "evidence": {
    "tests": [
      {
        "name": "full BAH test suite",
        "result": "PASS",
        "summary": "node --test 'test/*.test.mjs': 171 tests, 170 passed, 0 failed, 1 skipped because Windows denied test-symlink creation."
      },
      {
        "name": "BAH package audit",
        "result": "PASS",
        "summary": "node bin/audit-package.mjs returned valid=true with no findings."
      },
      {
        "name": "project ownership and checkpoint focus",
        "result": "PASS",
        "summary": "Project-brain ownership 2/2; takeover checkpoint 9/9."
      },
      {
        "name": "isolated offline website dependency install",
        "result": "KNOWN_FAILURE",
        "summary": "pnpm install --offline --frozen-lockfile --ignore-scripts could not find next-16.2.6.tgz in the local store; no tracked source was changed. The release will use the already-installed dependencies in the main checkout."
      },
      {
        "name": "BAH static production build and local release check",
        "result": "PASS",
        "summary": "`pnpm --dir website run build:netlify` succeeded. `website/out` has 35 static files, netlify.toml publishes `out`, and there is no function source. Local verify-public-site-release returned PASS at 127.0.0.1:4170; homepage and receipt returned HTTP 200 and the receipt matched source commit 0150713fcd92629dc0501b9550a8f31b2f414f27."
      },
      {
        "name": "exact BAH deployment candidate ZIP",
        "result": "PASS",
        "summary": "`work/bah-site-candidate-0150713.zip` contains 35 files at archive root; every ZIP entry SHA-256 matches website/out. Size 510,334 bytes; archive SHA-256 f4c71ea7c7e7bbc79fd879d82eda381a3a3601acceec1094b29a7260ad0f2d0a; functions 0."
      }
    ],
    "live": [
      {
        "target": "https://boundedagentharness.com",
        "result": "PASS",
        "observed_on": "2026-09-29T02:55:43Z",
        "deployment_id": "6abb266397e11d601df00913",
        "rollback_deployment_id": "6ab7542de0a386f0d1ec894f",
        "effect_boundary": "Production publication of the exact static BAH candidate from source commit 0150713fcd92629dc0501b9550a8f31b2f414f27: zero available/required/edge functions; all 34 public files matched the preserved ZIP; /release.json bound the candidate commit and website digest. No other site, DNS, database, payment, credential, or provider setting changed."
      }
    ],
    "known_problems": [
      {
        "scope": "Bundled Windows Git publication route",
        "status": "MITIGATED_HOST_QUIRK",
        "summary": "The checkout's origin pointed to a sibling local repository, older checkouts had sandbox ownership, and push could not find remote-https until GIT_EXEC_PATH was supplied from git --exec-path. The GitHub plugin exposed zero installed repositories, but the saved Git credential route remained valid and published the exact branch.",
        "next_action": "For future pushes, verify the canonical remote and checkout ownership, supply the bundled helper path to the push process, perform an explicit HTTPS dry run, and only then diagnose credentials. Follow OPERATOR-GUIDE.md."
      },
      {
        "scope": "Node test discovery with preserved worktrees",
        "status": "LOCAL_WORKTREE_DISCOVERY",
        "summary": "Bare `node --test` recursively discovered tests inside preserved worktrees under `work/`, including failed junction experiments. Those are unrelated to the main BAH test result; the explicit tracked test glob passes 170 tests with one host skip and zero failures.",
        "next_action": "While these preservation worktrees remain, use `node --test 'test/*.test.mjs'` for exact BAH verification. Do not delete preserved worktrees just to change test discovery."
      },
      {
        "scope": "project-scoped context host integration",
        "status": "NOT_IMPLEMENTED",
        "summary": "The gate and file-backed materializer are proven locally, but no production host is proven to call them before retrieval/injection.",
        "next_action": "Continue with the one host-neutral adapter defined in PROJECT-BRAIN/NEXT-STEP.md."
      },
      {
        "scope": "symlink test portability",
        "status": "HOST_SKIPPED",
        "summary": "Windows denied creation of the test symlink; the focused test exists but was skipped in this full-suite run.",
        "next_action": "Run the same suite on a host that allows symlink creation when available."
      }
    ]
  },
  "preservation_register": [
    {
      "path": "PROJECT-BRAIN/TAKEOVER-CHECKPOINT.v1.json",
      "kind": "FILE",
      "classification": "BAH continuation checkpoint being established",
      "state": "CURRENT",
      "action": "PRESERVE_IN_PLACE",
      "provenance": "BAH-owned continuation file for project_id bounded-agent-harness. This snapshot records the completed source publication, live static deployment, Git route root cause, preserved local output, and the next local host-boundary integration step.",
      "owner_decision_required": false,
      "availability": "REPOSITORY",
      "required_for": "Portable BAH continuation and safe Git-state validation."
    },
    {
      "path": "PROJECT-BRAIN/",
      "kind": "DIRECTORY",
      "classification": "BAH-owned current state, identity, and next step",
      "state": "CURRENT",
      "action": "PRESERVE_IN_PLACE",
      "provenance": "Created in this BAH-only source branch; excludes USB operational state and private add-on details.",
      "owner_decision_required": false,
      "availability": "REPOSITORY",
      "required_for": "BAH continuation and project separation."
    },
      {
      "path": "releases/boundedagentharness.com/2026-09-28-6abab040fab4a059dfd96ad1.json",
      "kind": "FILE",
      "classification": "Exact historical public deployment receipt",
      "state": "HISTORICAL",
      "action": "PRESERVE_IN_PLACE",
      "provenance": "Records the verified static production candidate and rollback; it grants no deployment authority.",
      "owner_decision_required": false,
      "availability": "REPOSITORY",
        "required_for": "Preserving the prior BAH production release evidence."
    },
    {